{"commentPolicy":"explain property contract and exact state transitions","constraints":[],"emits":"UCLASS source + property oracle","explicitAxes":[{"name":"cell","values":["baseline"]}],"mandatoryCellCount":1,"negativePolicy":"one illegal property declaration mutation","oracleKinds":["compile","metadata","default","read/write","return value"],"owner":"TestSource/Generation/Rules/Definitions","randomSlots":[{"kind":"legal default","name":"legal default"},{"kind":"identifier","name":"identifier"},{"kind":"independent member order","name":"independent member order"}],"recipeId":"uclass-property-family","recipeVersion":"1","schemaVersion":"recipe-v1"}
