{"commentPolicy":"explain API precondition and exact result","constraints":[],"emits":"support source + API oracle metadata","explicitAxes":[{"name":"cell","values":["baseline"]}],"mandatoryCellCount":1,"negativePolicy":"one invalid API state/argument","oracleKinds":["status","returned object/value","side effects","cleanup"],"owner":"TestSource/Generation/Rules/Embedding","randomSlots":[{"kind":"legal names/values when not API identity","name":"legal names/values when not API identity"}],"recipeId":"embedding-api-product","recipeVersion":"1","schemaVersion":"recipe-v1"}
