{"commentPolicy":"explain reflected signature and exact call observations","constraints":[],"emits":"UFUNCTION source + metadata/call oracle","explicitAxes":[{"name":"cell","values":["baseline"]}],"mandatoryCellCount":1,"negativePolicy":"one unsupported signature mutation","oracleKinds":["compile","metadata","invocation","return","writeback"],"owner":"TestSource/Generation/Rules/Definitions","randomSlots":[{"kind":"legal literals","name":"legal literals"},{"kind":"identifiers","name":"identifiers"},{"kind":"independent declaration order","name":"independent declaration order"}],"recipeId":"ufunction-signature-product","recipeVersion":"1","schemaVersion":"recipe-v1"}
