{"commentPolicy":"explain exact spelling and expected frontend observation","constraints":[],"emits":"source sections + token/AST/diagnostic oracle","explicitAxes":[{"name":"cell","values":["baseline"]}],"mandatoryCellCount":1,"negativePolicy":"one malformed lexical/parser mutation","oracleKinds":["token","AST","source position","diagnostic"],"owner":"TestSource/Generation/Rules/Frontend","randomSlots":[{"kind":"payload only outside explicit lexical axes","name":"payload only outside explicit lexical axes"}],"recipeId":"frontend-token-product","recipeVersion":"1","schemaVersion":"recipe-v1"}
