{"commentPolicy":"explain input files/directives and exact expansion","constraints":[],"emits":"multi-file source bundle + preprocessing oracle","explicitAxes":[{"name":"cell","values":["baseline"]}],"mandatoryCellCount":1,"negativePolicy":"one invalid directive/include mutation","oracleKinds":["expanded source","diagnostic","source mapping","compile"],"owner":"TestSource/Generation/Rules/Preprocessor","randomSlots":[{"kind":"macro/payload identifiers outside explicit axes","name":"macro/payload identifiers outside explicit axes"}],"recipeId":"preprocessor-product","recipeVersion":"1","schemaVersion":"recipe-v1"}
